year,title,url,time_place,track,description,speakers,speaker_details,files,photos
2023,"Fundraising Level Set: The Who, What, and Why of Venture Capital. And Other Non-Dilutive Options & More",https://tcsw2023.sched.com/event/1RnxW/fundraising-level-set-the-who-what-and-why-of-venture-capital-and-other-non-dilutive-options-more,,,,CSCasey SchultzDirector of Community & Impact Investing; avatar for Shannon Shroyer; avatar for Reed Robinson; avatar for Reed Robinson; avatar for Reed Robinson,"[{""name"": ""CSCasey SchultzDirector of Community & Impact Investing"", ""role"": """", ""company"": ""Saint Paul and Minnesota Foundation"", ""avatar_url"": ""//cdn.sched.co/common/img/icon-google-maps.png""}, {""name"": ""avatar for Shannon Shroyer"", ""role"": """", ""company"": """", ""avatar_url"": ""//avatars.sched.co/4/fb/18935898/avatar.jpg?976""}, {""name"": ""avatar for Reed Robinson"", ""role"": """", ""company"": ""Groove Capital"", ""avatar_url"": ""//avatars.sched.co/8/18/1798156/avatar.jpg?b92""}, {""name"": ""avatar for Reed Robinson"", ""role"": """", ""company"": ""M25"", ""avatar_url"": ""//avatars.sched.co/8/18/1798156/avatar.jpg?b92""}, {""name"": ""avatar for Reed Robinson"", ""role"": """", ""company"": """", ""avatar_url"": ""//avatars.sched.co/8/18/1798156/avatar.jpg?b92""}]",,
2023,Design Secrets for Startups,https://tcsw2023.sched.com/event/1RHsB/design-secrets-for-startups,,,,avatar for Olivia Mortensen,"[{""name"": ""avatar for Olivia Mortensen"", ""role"": """", ""company"": ""Mortensen Designs"", ""avatar_url"": ""//avatars.sched.co/b/c6/19182258/avatar.jpg?2af""}]",,
2023,Founders' Guide to HR & People Ops: What You Need and When,https://tcsw2023.sched.com/event/1ROie/founders-guide-to-hr-people-ops-what-you-need-and-when,,,,avatar for Victoria Schanen; avatar for Becky Lauseng; avatar for Heidi Balley; avatar for Jessi Howard,"[{""name"": ""avatar for Victoria Schanen"", ""role"": """", ""company"": ""ghrow.ioVictoria partners with Founders and CEOs to grow and invest in their company's most important asset - their people. Her passion is building HR and Recruiting functions from scratch for SaaS startups with under 50 employees and no HR on staff. She founded Ghrow.io to support and add...Read More →"", ""avatar_url"": ""//avatars.sched.co/b/68/19030158/avatar.jpg?32e""}, {""name"": ""avatar for Becky Lauseng"", ""role"": """", ""company"": ""Onsights.ioCome talk to me about building the HR/People foundation at startup/emerging growth companies!I specialize in scaling, building engaged cultures and communities, change management, leadership development/coaching, leadership team alignment and full employee lifecycle HR."", ""avatar_url"": ""//avatars.sched.co/5/75/19184765/avatar.jpg?bc6""}, {""name"": ""avatar for Heidi Balley"", ""role"": """", ""company"": ""Ingredient"", ""avatar_url"": ""//avatars.sched.co/a/98/19184778/avatar.jpg?7fa""}, {""name"": ""avatar for Jessi Howard"", ""role"": """", ""company"": ""Rally VenturesJessi Howard has 20 years of experience in Human Resources, and she has spent the majority of her career in the technology industry.As Rally Ventures’ Chief People Officer, Jessi leads the firm’s HR practice and operates as the Fractional Chief People Officer for Rally portfolio companies, providing strategic guidance and tactical support around expanding and supporting their teams. Prior to joining Rally...Read More →"", ""avatar_url"": ""//avatars.sched.co/1/d4/19184783/avatar.jpg?655""}]",,
2023,Show Me The Money: Sourcing Capital in a Tight Market,https://tcsw2023.sched.com/event/1RI0S/show-me-the-money-sourcing-capital-in-a-tight-market,,,,avatar for Mike Quesnell,"[{""name"": ""avatar for Mike Quesnell"", ""role"": """", ""company"": ""angel networks, VCs, and other accelerators for Pre-seed/Seed founders drawing on my network to support their hunt for investments. I also co-lead the Ocean High Tech Accelerator which helps early-stage founders...Read More →"", ""avatar_url"": ""//avatars.sched.co/7/a4/5505974/avatar.jpg?127""}]",,
2023,Humanizing M&A,https://tcsw2023.sched.com/event/1RLmo/humanizing-ma,,,,avatar for James Olsen; avatar for James Olsen; avatar for Garrio Harrison; avatar for Mike Polt; avatar for Mike Polt,"[{""name"": ""avatar for James Olsen"", ""role"": """", ""company"": ""Seiler Law PLLCI work with people who want to start a business and small business owners who want to grow their business.Business Attorney | Entertainment Attorney | Mergers & AcquisitionsEmail:[email protected]"", ""avatar_url"": ""//avatars.sched.co/4/8b/19180257/avatar.jpg?1d9""}, {""name"": ""avatar for James Olsen"", ""role"": """", ""company"": """", ""avatar_url"": ""//avatars.sched.co/4/8b/19180257/avatar.jpg?1d9""}, {""name"": ""avatar for Garrio Harrison"", ""role"": """", ""company"": ""StonefordThroughout my career, I have had the pleasure of helping founders, builders, corporate entrepreneurs, and small business owners align their sales and marketing efforts to achieve the growth they know is possible.During that time, one consistent challenge I have observed, spanning...Read More →"", ""avatar_url"": ""https://graph.facebook.com/v17.0/859841490454/picture?width=400&height=400""}, {""name"": ""avatar for Mike Polt"", ""role"": """", ""company"": ""Growth OperatorsA passionate, focused and results oriented human resources professional with the proven ability to combine a vision, creativity, project management, and leadership qualities to support and serve the business strategy. Extensive experience in all aspects of human resources and known...Read More →"", ""avatar_url"": ""//avatars.sched.co/0/66/19276010/avatar.jpg?c99""}, {""name"": ""avatar for Mike Polt"", ""role"": """", ""company"": ""Revience Corporation"", ""avatar_url"": ""//avatars.sched.co/0/66/19276010/avatar.jpg?c99""}]",,
2023,How To Raise Seed Capital From VCs: The Process For A Successful Fundraise,https://tcsw2023.sched.com/event/1Rnys/how-to-raise-seed-capital-from-vcs-the-process-for-a-successful-fundraise,,,,"avatar for Stephanie Rich; avatar for Shannon Shroyer; avatar for Elizabeth Orme, Ed.S.; avatar for Mickayla Rosard; avatar for Mickayla Rosard","[{""name"": ""avatar for Stephanie Rich"", ""role"": """", ""company"": ""Platform, Bread & Butter VenturesStephanie Rich is Partner, Platform at B&B where she works to add continuous value to portfolio companies and founders. She is the former Entrepreneur-in-Residence at Techstars Farm to Fork Accelerator in partnership with Cargill and Ecolab. Steph has worked with numerous early stage...Read More →"", ""avatar_url"": ""//avatars.sched.co/7/fd/19238927/avatar.jpg?e00""}, {""name"": ""avatar for Shannon Shroyer"", ""role"": """", ""company"": """", ""avatar_url"": ""//avatars.sched.co/4/fb/18935898/avatar.jpg?976""}, {""name"": ""avatar for Elizabeth Orme, Ed.S."", ""role"": """", ""company"": ""Ed.S.Founder and CEO, Creatively FocusedElizabeth Orme, Ed.S., Founder and CEO of Creatively Focused, is revolutionizing special education by integrating technology and artificial intelligence to support educators. A former special education director and school board member, she brings firsthand experience to her work...Read More →"", ""avatar_url"": ""//avatars.sched.co/c/b7/19180583/avatar.jpg?779""}, {""name"": ""avatar for Mickayla Rosard"", ""role"": """", ""company"": ""Groove CapitalMickayla is Partner at Groove Capital, a pre-seed venture fund and angel network focused on Minnesota companies. Additionally, Mickayla is a Fellow at Forge North, a coalition of more than 150 partners – individuals and organizations - across the Twin Cities startup ecosystem. Here...Read More →"", ""avatar_url"": ""//avatars.sched.co/5/3a/19214451/avatar.jpg?701""}, {""name"": ""avatar for Mickayla Rosard"", ""role"": """", ""company"": ""Bread & Butter Ventures"", ""avatar_url"": ""//avatars.sched.co/5/3a/19214451/avatar.jpg?701""}]",,
2023,Cannabis Breeding 101: Growing Cannabis for Seeds,https://tcsw2023.sched.com/event/1RHqD/cannabis-breeding-101-growing-cannabis-for-seeds,,,,avatar for Dane Theisen,"[{""name"": ""avatar for Dane Theisen"", ""role"": """", ""company"": """", ""avatar_url"": ""//avatars.sched.co/2/20/19172579/avatar.jpg?c16""}]",,
2023,Leveling the Playing Field: Understanding Term Sheets & What is Being Negotiated,https://tcsw2023.sched.com/event/1Q8Fo/leveling-the-playing-field-understanding-term-sheets-what-is-being-negotiated,,,,avatar for Shannon Shroyer; avatar for Shannon Shroyer; avatar for Shannon Shroyer; avatar for Shannon Shroyer; avatar for Shannon Shroyer,"[{""name"": ""avatar for Shannon Shroyer"", ""role"": """", ""company"": """", ""avatar_url"": ""//avatars.sched.co/4/fb/18935898/avatar.jpg?976""}, {""name"": ""avatar for Shannon Shroyer"", ""role"": """", ""company"": """", ""avatar_url"": ""//avatars.sched.co/4/fb/18935898/avatar.jpg?976""}, {""name"": ""avatar for Shannon Shroyer"", ""role"": """", ""company"": ""JPMorgan"", ""avatar_url"": ""//avatars.sched.co/4/fb/18935898/avatar.jpg?976""}, {""name"": ""avatar for Shannon Shroyer"", ""role"": """", ""company"": ""Koley Jessen"", ""avatar_url"": ""//avatars.sched.co/4/fb/18935898/avatar.jpg?976""}, {""name"": ""avatar for Shannon Shroyer"", ""role"": """", ""company"": ""Techstars"", ""avatar_url"": ""//avatars.sched.co/4/fb/18935898/avatar.jpg?976""}]",,
2023,Using AI to Bridge the Knowledge Gap: Fewer Tradespersons + Highly Complex Products,https://tcsw2023.sched.com/event/1RHlW/using-ai-to-bridge-the-knowledge-gap-fewer-tradespersons-+-highly-complex-products,,,,avatar for Michael Petersen,"[{""name"": ""avatar for Michael Petersen"", ""role"": """", ""company"": ""Raise a HoodCEO & Founder of Raise a Hood.Synthesizing engineering prowess, tactical operations skills, and marketing experience to develop new products and solutions to tackle big problems. Enjoys building outstanding specialized teams that are committed to a shared vision. Energized by disrupting the status quo for better...Read More →"", ""avatar_url"": ""//avatars.sched.co/b/bd/19172423/avatar.jpg?85a""}]",,
2023,Experts on Tap - Leveraging Fractional Leaders in Startups,https://tcsw2023.sched.com/event/1RI7d/experts-on-tap-leveraging-fractional-leaders-in-startups,,,,avatar for Mark Payne; avatar for Alex Bangs; avatar for Victoria Schanen,"[{""name"": ""avatar for Mark Payne"", ""role"": """", ""company"": ""Payne Advisory Services, LLCFractional CFO/COO focused in emerging growth companies with revenues between $0 and $20 million.  Very comfortable with start-ups and working with entrepreneurs."", ""avatar_url"": ""//avatars.sched.co/f/e2/7612292/avatar.jpg?78c""}, {""name"": ""avatar for Alex Bangs"", ""role"": """", ""company"": ""Allevo AdvisorsAlex is an experienced technology and startup leader with a focus on mission-driven organizations, especially in healthcare and life sciences. He was the CTO/CIO for three startups in Silicon Valley with two successful exits (Entelos - Co-Founder & CTO; Crescendo Bioscience - CIO...Read More →"", ""avatar_url"": ""//avatars.sched.co/b/51/18348819/avatar.jpg?c6e""}, {""name"": ""avatar for Victoria Schanen"", ""role"": """", ""company"": ""ghrow.ioVictoria partners with Founders and CEOs to grow and invest in their company's most important asset - their people. Her passion is building HR and Recruiting functions from scratch for SaaS startups with under 50 employees and no HR on staff. She founded Ghrow.io to support and add...Read More →"", ""avatar_url"": ""//avatars.sched.co/b/68/19030158/avatar.jpg?32e""}]",,
2023,"Data, Health, and Community",https://tcsw2023.sched.com/event/1RHyc/data-health-and-community,,,,avatar for Ali Shirvani-Mahdavi,"[{""name"": ""avatar for Ali Shirvani-Mahdavi"", ""role"": """", ""company"": """", ""avatar_url"": ""//avatars.sched.co/9/83/19172649/avatar.jpg?5be""}]",,
2023,Fireside Chat: Building a Winning Funding Structure for Founders,https://tcsw2023.sched.com/event/1SH4z/fireside-chat-building-a-winning-funding-structure-for-founders,,,,avatar for Cihan Behlivan; avatar for Cihan Behlivan; avatar for Cihan Behlivan; avatar for Cihan Behlivan; avatar for Cihan Behlivan,"[{""name"": ""avatar for Cihan Behlivan"", ""role"": """", ""company"": ""BETA MN"", ""avatar_url"": ""//avatars.sched.co/a/64/19239704/avatar.jpg?1d7""}, {""name"": ""avatar for Cihan Behlivan"", ""role"": """", ""company"": ""Bison X"", ""avatar_url"": ""//avatars.sched.co/a/64/19239704/avatar.jpg?1d7""}, {""name"": ""avatar for Cihan Behlivan"", ""role"": """", ""company"": ""Camber Road"", ""avatar_url"": ""//avatars.sched.co/a/64/19239704/avatar.jpg?1d7""}, {""name"": ""avatar for Cihan Behlivan"", ""role"": """", ""company"": ""Mairs & Power Venture Capital"", ""avatar_url"": ""//avatars.sched.co/a/64/19239704/avatar.jpg?1d7""}, {""name"": ""avatar for Cihan Behlivan"", ""role"": """", ""company"": ""Silicon Valley Bank"", ""avatar_url"": ""//avatars.sched.co/a/64/19239704/avatar.jpg?1d7""}]",,
2023,Risk Management & Liability for Small Businesses,https://tcsw2023.sched.com/event/1RI8A/risk-management-liability-for-small-businesses,,,,SSShane SolingerFaegre Drinker,"[{""name"": ""SSShane SolingerFaegre Drinker"", ""role"": """", ""company"": """", ""avatar_url"": ""//cdn.sched.co/common/img/icon-google-maps.png""}]",,
2023,"VC Market Trends: What it Takes to Raise a Seed, Series A, and Beyond in 2023",https://tcsw2023.sched.com/event/1RI1m/vc-market-trends-what-it-takes-to-raise-a-seed-series-a-and-beyond-in-2023,,,,avatar for Andrew Felbinger,"[{""name"": ""avatar for Andrew Felbinger"", ""role"": """", ""company"": ""Urban Innovation FundAndrew is an Associate at the Urban Innovation Fund, a venture capital firm that invests in the future of cities. The fund provides seed capital and regulatory support to entrepreneurs solving our toughest urban challenges – helping them grow into tomorrow’s most valued companies...Read More →"", ""avatar_url"": ""//avatars.sched.co/8/d1/6098779/avatar.jpg?566""}]",,
2023,The Shared Success Agreement: A new funding category that is democratizing entrepreneurship AND investing,https://tcsw2023.sched.com/event/1RHnV/the-shared-success-agreement-a-new-funding-category-that-is-democratizing-entrepreneurship-and-investing,,,,avatar for Zack Steven,"[{""name"": ""avatar for Zack Steven"", ""role"": """", ""company"": ""Cloudburst SBCCreator of the Shared Success Agreement | CEO @ Cloudburst SBC | Partner@Monkey Island VenturesCurious Optimist | Dad | Entrepreneur. Fan of good design, big ideas & strong communities."", ""avatar_url"": ""//avatars.sched.co/e/3e/6013144/avatar.jpg?648""}]",,
2023,VC Day Founders and Funders Happy Hour,https://tcsw2023.sched.com/event/1RU1c/vc-day-founders-and-funders-happy-hour,,,,avatar for Jeffrey Robbins; avatar for Jeffrey Robbins; avatar for Shannon Shroyer; avatar for Sara Russick; avatar for Sara Russick,"[{""name"": ""avatar for Jeffrey Robbins"", ""role"": """", ""company"": ""Jeff has represented entrepreneurs who start and grow technology-based enterprises and angel and venture investors who target those companies. Clients seek his assistance in strategic business plan development; entity selection and formation; private and public...Read More →"", ""avatar_url"": ""//avatars.sched.co/9/22/9167212/avatar.jpg?f09""}, {""name"": ""avatar for Jeffrey Robbins"", ""role"": """", ""company"": ""JPMorgan"", ""avatar_url"": ""//avatars.sched.co/9/22/9167212/avatar.jpg?f09""}, {""name"": ""avatar for Shannon Shroyer"", ""role"": """", ""company"": """", ""avatar_url"": ""//avatars.sched.co/4/fb/18935898/avatar.jpg?976""}, {""name"": ""avatar for Sara Russick"", ""role"": """", ""company"": ""Gopher Angels"", ""avatar_url"": ""//avatars.sched.co/f/19/19029876/avatar.jpg?795""}, {""name"": ""avatar for Sara Russick"", ""role"": """", ""company"": """", ""avatar_url"": ""//avatars.sched.co/f/19/19029876/avatar.jpg?795""}]",,
2023,Leadership Lessons: Feeling Our Way Beyond Allyship,https://tcsw2023.sched.com/event/1RHon/leadership-lessons-feeling-our-way-beyond-allyship,,,,DJDawn JohnsonDawn L Johnson LLC; avatar for Renita Faye,"[{""name"": ""DJDawn JohnsonDawn L Johnson LLC"", ""role"": """", ""company"": """", ""avatar_url"": ""//cdn.sched.co/common/img/icon-google-maps.png""}, {""name"": ""avatar for Renita Faye"", ""role"": """", ""company"": ""Addwomxn"", ""avatar_url"": ""//avatars.sched.co/c/ed/19185917/avatar.jpg?1d5""}]",,
2023,Crafting Success: The Startup's Journey from Concept to Customer,https://tcsw2023.sched.com/event/1S1x9/crafting-success-the-startups-journey-from-concept-to-customer,,,,"avatar for Andrew DeLeeuw; avatar for Pearce McCarty, MD, MBA","[{""name"": ""avatar for Andrew DeLeeuw"", ""role"": """", ""company"": ""DOCSI"", ""avatar_url"": ""//avatars.sched.co/1/ef/19268228/avatar.jpg?bc1""}, {""name"": ""avatar for Pearce McCarty, MD, MBA"", ""role"": """", ""company"": ""MD, MBACo-Founder | Chief Medical Officer, DOCSITalk to Pearce about healthcare, medical device and healthcare IT topics, as well as early stage investment in the healthcare space.Pearce is an experienced orthopedic surgeon, entrepreneur and health care leader passionate about making health care more efficient, affordable and higher quality for patients. He holds multiple medical device patents and founded a healthcare IT company in 2021, DOCSI, devoted to...Read More →"", ""avatar_url"": ""//avatars.sched.co/1/59/19268267/avatar.jpg?b94""}]",,
2023,Product Folk: A Community for Product Managers,https://tcsw2023.sched.com/event/1RICS/product-folk-a-community-for-product-managers,,,,MSMatt SchraanLivefront; JMJennifer MorganLivefront,"[{""name"": ""MSMatt SchraanLivefront"", ""role"": """", ""company"": """", ""avatar_url"": ""//cdn.sched.co/common/img/icon-google-maps.png""}, {""name"": ""JMJennifer MorganLivefront"", ""role"": """", ""company"": """", ""avatar_url"": ""//cdn.sched.co/common/img/icon-google-maps.png""}]",,
2023,Minnedemo39,https://tcsw2023.sched.com/event/1Rcap/minnedemo39,,,,avatar for Sarah Olson,"[{""name"": ""avatar for Sarah Olson"", ""role"": """", ""company"": ""Minnestar"", ""avatar_url"": ""//avatars.sched.co/0/a3/19196981/avatar.jpg?86a""}]",,
2023,Exploring the Application of Computer Vision in Elite Sports – The Value Proposition and Integration Challenges,https://tcsw2023.sched.com/event/1Q8hu/exploring-the-application-of-computer-vision-in-elite-sports-the-value-proposition-and-integration-challenges,,,,PPPrashanth PollishettyCEO; VKVarun KodathalaAI Engineer,"[{""name"": ""PPPrashanth PollishettyCEO"", ""role"": """", ""company"": ""Vizworld Inc"", ""avatar_url"": ""//cdn.sched.co/common/img/icon-google-maps.png""}, {""name"": ""VKVarun KodathalaAI Engineer"", ""role"": """", ""company"": ""Vizworld Inc."", ""avatar_url"": ""//cdn.sched.co/common/img/icon-google-maps.png""}]",,
2023,Leading Adoption at the Speed of AI,https://tcsw2023.sched.com/event/1SB8T/leading-adoption-at-the-speed-of-ai,,,,avatar for Luke Vestrum; avatar for Luke Vestrum; avatar for Tim Brunelle,"[{""name"": ""avatar for Luke Vestrum"", ""role"": """", ""company"": ""Tempo by Clockwork"", ""avatar_url"": ""https://graph.facebook.com/v17.0/10168401508890122/picture?width=400&height=400""}, {""name"": ""avatar for Luke Vestrum"", ""role"": """", ""company"": ""Tempo by Clockwork"", ""avatar_url"": ""https://graph.facebook.com/v17.0/10168401508890122/picture?width=400&height=400""}, {""name"": ""avatar for Tim Brunelle"", ""role"": """", ""company"": ""MCAD Adjunct FacultyDad. Minnesotan. Creative entrepreneur. Adjunct faculty at MCAD."", ""avatar_url"": ""//avatars.sched.co/3/c4/19242126/avatar.jpg?17b""}]",,
2023,Swapping your golden parachute for the contract on a paper napkin,https://tcsw2023.sched.com/event/1RHlt/swapping-your-golden-parachute-for-the-contract-on-a-paper-napkin,,,,avatar for Anna Kincannon,"[{""name"": ""avatar for Anna Kincannon"", ""role"": """", ""company"": ""InkitI thrive on challenge and constant motion. I excel at building something new and making a difference. I lead with inclusion, compassion, and knowledge.I bring 18+ years of experience and knowledge in banking and the financial industry.Is it true when you switch careers from the c...Read More →"", ""avatar_url"": ""//avatars.sched.co/6/2d/19172426/avatar.jpg?3a1""}]",,
2023,3D Printing the entire design cycle,https://tcsw2023.sched.com/event/1RLvK/3d-printing-the-entire-design-cycle,,,,CSCharlie SeitzerStratasys,"[{""name"": ""CSCharlie SeitzerStratasys"", ""role"": """", ""company"": """", ""avatar_url"": ""//cdn.sched.co/common/img/icon-google-maps.png""}]",,
2023,"Mastering Brand Communication: Strategies for Attracting, Hiring, and Nurturing Your Perfect Workforce",https://tcsw2023.sched.com/event/1RHeA/mastering-brand-communication-strategies-for-attracting-hiring-and-nurturing-your-perfect-workforce,,,,avatar for Jolly Nanda,"[{""name"": ""avatar for Jolly Nanda"", ""role"": """", ""company"": ""Altheia IncInnovationAI in healthcareDriving Sustainable Change"", ""avatar_url"": ""//avatars.sched.co/b/1c/19172157/avatar.jpg?981""}]",EVPpdf,
2023,"Big Data, Bigger Responsibility: Diversity and Ethics in the Age of AI",https://tcsw2023.sched.com/event/1RHWr/big-data-bigger-responsibility-diversity-and-ethics-in-the-age-of-ai,,,,avatar for Zikomo Fields,"[{""name"": ""avatar for Zikomo Fields"", ""role"": """", ""company"": ""Insight AutonomyMy dad taught me how to program when I was 5 years old and I've been coding ever since. My career has revolved around machine perception from cameras to sensors. Over the last few years I've been taking a deep dive into machine learning which lead me to found Insight Autonomy a company...Read More →"", ""avatar_url"": ""//avatars.sched.co/1/f0/19238540/avatar.jpg?76a""}]",,
2023,The Future of AI and GenAI - What will be the impact to Startups and Big Companies?,https://tcsw2023.sched.com/event/1RHTY/the-future-of-ai-and-genai-what-will-be-the-impact-to-startups-and-big-companies,,,,avatar for Michael Arulfo; avatar for Michael Arulfo; avatar for Michael Arulfo,"[{""name"": ""avatar for Michael Arulfo"", ""role"": """", ""company"": ""Boston ScientificI am a Principal Enterprise Architect and Co- Leader of the GenAI Architecture Strategy at Boston Scientific, a Fortune 300 company and one of the most admired companies in the world (per Fortune magazine). I have over 20 years of experience in designing and developing enterprise...Read More →"", ""avatar_url"": ""https://graph.facebook.com/v17.0/10167905244070263/picture?width=400&height=400""}, {""name"": ""avatar for Michael Arulfo"", ""role"": """", ""company"": """", ""avatar_url"": ""https://graph.facebook.com/v17.0/10167905244070263/picture?width=400&height=400""}, {""name"": ""avatar for Michael Arulfo"", ""role"": """", ""company"": """", ""avatar_url"": ""https://graph.facebook.com/v17.0/10167905244070263/picture?width=400&height=400""}]",,
2023,Strategies for Business Growth and Funding,https://tcsw2023.sched.com/event/1RLlD/strategies-for-business-growth-and-funding,,,,avatar for Robert Keeley; avatar for Patricia Tatro; avatar for Rob Weber; avatar for Russ Straate; avatar for David Mauch,"[{""name"": ""avatar for Robert Keeley"", ""role"": """", ""company"": ""CLA (CliftonLarsonAllen LLP)"", ""avatar_url"": ""//avatars.sched.co/b/be/6095902/avatar.jpg?d76""}, {""name"": ""avatar for Patricia Tatro"", ""role"": """", ""company"": ""CLA (CliftonLarsonAllen LLP)"", ""avatar_url"": ""//avatars.sched.co/a/0c/19180241/avatar.jpg?c8f""}, {""name"": ""avatar for Rob Weber"", ""role"": """", ""company"": ""Great North Ventures"", ""avatar_url"": ""//avatars.sched.co/a/64/19194506/avatar.jpg?7dc""}, {""name"": ""avatar for Russ Straate"", ""role"": """", ""company"": ""University of Minnesota - Technology Commercialization"", ""avatar_url"": ""//avatars.sched.co/9/c7/19261962/avatar.jpg?5ab""}, {""name"": ""avatar for David Mauch"", ""role"": """", ""company"": ""BizOps Chief Financial Officer, CLA (CliftonLarsonAllen LLP)"", ""avatar_url"": ""//avatars.sched.co/1/92/19261964/avatar.jpg?81d""}]",,
2023,Finance Lounge: Casual environment for tough questions,https://tcsw2023.sched.com/event/1S2E0/finance-lounge-casual-environment-for-tough-questions,,,,avatar for Brian Adamek; avatar for Lana Nelson,"[{""name"": ""avatar for Brian Adamek"", ""role"": """", ""company"": ""E-Wealth PartnersAs the firm’s founder and lead financial planner, Brian is committed to helping clients achieve their financial goals. As an entrepreneur himself, he understands the challenges they face.Brian has more than a decade of experience in wealth management and is credentialed in adva...Read More →"", ""avatar_url"": ""//avatars.sched.co/5/43/19299678/avatar.jpg?4d3""}, {""name"": ""avatar for Lana Nelson"", ""role"": """", ""company"": ""Business Development, All In One Accounting"", ""avatar_url"": ""//avatars.sched.co/3/85/19269489/avatar.jpg?6cb""}]",,
2023,From Artist to Entrepreneur: How a background in the arts can supercharge a career in business,https://tcsw2023.sched.com/event/1RHmH/from-artist-to-entrepreneur-how-a-background-in-the-arts-can-supercharge-a-career-in-business,,,,avatar for Michael Cain,"[{""name"": ""avatar for Michael Cain"", ""role"": """", ""company"": ""EkweEkwe! We're building music 2.0!Ekwe is a unique digital tool for music making, which brings a new level of ease and access to digital music creation. By combining a library of 150 sampled authentic musical instruments from around the world with contemporary electronic loops and instruments, accessed through an i...Read More →"", ""avatar_url"": ""//avatars.sched.co/c/3b/19184381/avatar.jpg?bc8""}]",,
